{
    "version": "1.0",
    "id": "scope_while_example",
    "name": "Scope – While Policy",
    "description": "Demonstrates the while-scope policy. After scope_close completes the orchestrator evaluates the condition expression against the current session data. If it evaluates to True (and max_iterations has not been reached) all scope tasks are reset to PENDING for another iteration. The condition reads 'elements_remaining', which 'init' seeds as a declared output. Since the sleep tasks standing in for real work never decrement it, this example loops until max_iterations caps it and then moves on to finalise.",
    "tasks": [
        {
            "id": "start",
            "type": "system.start"
        },
        {
            "id": "init",
            "type": "system.sleep",
            "description": "Initialisation step before the loop. Seeds the counter the while condition reads – a real agent would compute it from the model instead of declaring a fixed value.",
            "params": [
                {
                    "name": "duration",
                    "value": 2
                }
            ],
            "outputs": [
                {
                    "name": "elements_remaining",
                    "value": 3,
                    "type": "int",
                    "description": "How many elements are left to process. Declared with a value so the count exists in session data before the first evaluation of the while condition."
                }
            ],
            "depends_on": [
                {
                    "id": "start"
                }
            ]
        },
        {
            "id": "scope_open",
            "type": "system.sleep",
            "description": "Opens the while scope. Condition expression and optional max_iterations are declared in while_policy.",
            "scope_start": {
                "while_policy": {
                    "condition": "elements_remaining > 0",
                    "max_iterations": 10
                }
            },
            "params": [
                {
                    "name": "duration",
                    "value": 2
                }
            ],
            "depends_on": [
                {
                    "id": "init"
                }
            ]
        },
        {
            "id": "pick_element",
            "type": "system.sleep",
            "description": "Pick the next element to process. A real agent would declare 'elements_remaining' as an output here too and return the decremented count, which is what ends the loop before max_iterations.",
            "params": [
                {
                    "name": "duration",
                    "value": 2
                }
            ],
            "depends_on": [
                {
                    "id": "scope_open"
                }
            ]
        },
        {
            "id": "place_element",
            "type": "system.sleep",
            "description": "Place / fabricate the element.",
            "params": [
                {
                    "name": "duration",
                    "value": 2
                }
            ],
            "depends_on": [
                {
                    "id": "pick_element"
                }
            ]
        },
        {
            "id": "scope_close",
            "type": "system.sleep",
            "description": "Closes the scope. The orchestrator evaluates while_policy.condition against session data.",
            "scope_end": "scope_open",
            "params": [
                {
                    "name": "duration",
                    "value": 2
                }
            ],
            "depends_on": [
                {
                    "id": "place_element"
                }
            ]
        },
        {
            "id": "finalise",
            "type": "system.sleep",
            "description": "Runs once, after all elements have been processed.",
            "params": [
                {
                    "name": "duration",
                    "value": 2
                }
            ],
            "depends_on": [
                {
                    "id": "scope_close"
                }
            ]
        },
        {
            "id": "end",
            "type": "system.end",
            "depends_on": [
                {
                    "id": "finalise"
                }
            ]
        }
    ]
}