{
    "version": "1.0",
    "id": "toy-problem-1",
    "name": "Toy Problem 1",
    "description": "A sample fabrication process definition",
    "tasks": [
        {
            "id": "start",
            "type": "system.start",
            "outputs": [
                {
                    "name": "process_start_time",
                    "type_hint": "timestamp"
                }
            ]
        },
        {
            "id": "A1",
            "type": "user_interaction.user_input",
            "description": "Wait for user input",
            "outputs": [
                {
                    "name": "result1",
                    "type_hint": "str"
                }
            ],
            "depends_on": [
                {
                    "id": "start"
                }
            ]
        },
        {
            "id": "A2",
            "type": "system.sleep",
            "description": "Sleep for 5 seconds",
            "params": [
                {
                    "name": "duration",
                    "value": 5
                }
            ],
            "depends_on": [
                {
                    "id": "start"
                }
            ]
        },
        {
            "id": "B1",
            "type": "user_interaction.user_output",
            "description": "Print result",
            "inputs": [
                {
                    "name": "result1",
                    "type_hint": "str"
                },
                {
                    "name": "frame_world_xy",
                    "value": {
                        "dtype": "compas.geometry/Frame",
                        "data": {
                            "point": [
                                0.0,
                                0.0,
                                0.0
                            ],
                            "xaxis": [
                                1.0,
                                0.0,
                                0.0
                            ],
                            "yaxis": [
                                0.0,
                                1.0,
                                0.0
                            ]
                        },
                        "guid": "55982853-464f-49f0-a85a-f5a4a8b11de7"
                    }
                }
            ],
            "depends_on": [
                {
                    "id": "A1",
                    "type": "FS"
                },
                {
                    "id": "A2",
                    "type": "FS"
                }
            ]
        },
        {
            "id": "end",
            "type": "system.end",
            "outputs": [
                {
                    "name": "process_end_time",
                    "type_hint": "timestamp"
                }
            ],
            "depends_on": [
                {
                    "id": "B1"
                }
            ]
        }
    ]
}