{
  "version": "1.0",
  "id": "TP5-inner",
  "name": "Toy Problem 5: Pick and Place",
  "description": "Pick and place",
  "tasks": [
    {
      "id": "start",
      "type": "system.start",
      "outputs": [
        {
          "name": "process_start_time",
          "type_hint": "timestamp"
        }
      ]
    },
    {
      "id": "pnp0",
      "type": "compas_fab.moveit.generate_pick_location_frame",
      "outputs": [
        {
          "name": "pickup_location_frame",
          "type_hint": "compas.geometry.Frame"
        }
      ],
      "depends_on": [
        {
          "id": "start"
        }
      ]
    },
    {
      "id": "pnp1",
      "type": "compas_fab.moveit.plan_pick",
      "params": [
        {
          "name": "element_id",
          "value": "1515240e-882e-4a8a-8399-a3efa866f49b"
        },
        {
          "name": "approach_vector",
          "value": "(1, 0, 0)"
        }
      ],
      "inputs": [
        {
          "name": "pickup_location_frame",
          "type_hint": "compas.geometry.Frame"
        }
      ],
      "outputs": [
        {
          "name": "trajectories",
          "type_hint": "list[compas_fab.robots.Trajectory]"
        }
      ],
      "depends_on": [
        {
          "id": "pnp0"
        }
      ]
    },
    {
      "id": "pnp2",
      "type": "compas_fab.moveit.plan_place",
      "outputs": [
        {
          "name": "process_start_time",
          "type_hint": "timestamp"
        }
      ],
      "depends_on": [
        {
          "id": "pnp1"
        }
      ]
    },
    {
      "id": "end",
      "type": "system.end",
      "outputs": [
        {
          "name": "process_end_time",
          "type_hint": "timestamp"
        }
      ],
      "depends_on": [
        {
          "id": "pnp2"
        }
      ]
    }
  ]
}