{
    "version": "1.0",
    "id": "TP6",
    "name": "Toy Problem 6",
    "description": "Model and basic element sequencer",
    "tasks": [
        {
            "id": "start",
            "type": "system.start",
            "outputs": [
                {
                    "name": "process_start_time",
                    "type_hint": "timestamp"
                }
            ]
        },
        {
            "id": "X1",
            "type": "system.composite",
            "description": "Process element",
            "params": [
                {
                    "name": "blueprint",
                    "value": {
                        "dynamic": {
                            "blueprint": "TP6-inner",
                            "sequencer": "basic_element_sequencer"
                        }
                    }
                },
                {
                    "name": "execution_mode",
                    "value": "COMPETITIVE"
                }
            ],
            "inputs": [
                {
                    "name": "model_id",
                    "type_hint": "str"
                }
            ],
            "outputs": [
                {
                    "name": "result",
                    "type_hint": "str"
                }
            ],
            "depends_on": [
                {
                    "id": "start"
                }
            ]
        },
        {
            "id": "end",
            "type": "system.end",
            "outputs": [
                {
                    "name": "process_end_time",
                    "type_hint": "timestamp"
                }
            ],
            "depends_on": [
                {
                    "id": "X1"
                }
            ]
        }
    ]
}