{
    "version": "1.0",
    "id": "toy-problem-competitive",
    "name": "Toy Problem 10 Competitive",
    "description": "Showcase competitive execution mode",
    "tasks": [
        {
            "id": "start",
            "type": "system.start",
            "outputs": [
                {
                    "name": "start_time"
                }
            ]
        },
        {
            "id": "race_confirmation",
            "type": "user_prompt.confirm",
            "params": [
                {
                    "name": "message",
                    "value": "Who clicks first?"
                },
                {
                    "name": "options",
                    "value": [
                        "Me!",
                        "No, me!"
                    ]
                },
                {
                    "name": "execution_mode",
                    "value": "COMPETITIVE"
                }
            ],
            "outputs": [
                {
                    "name": "result",
                    "type_hint": "str"
                }
            ],
            "depends_on": [
                {
                    "id": "start"
                }
            ]
        },
        {
            "id": "end",
            "type": "system.end",
            "depends_on": [
                {
                    "id": "race_confirmation"
                }
            ]
        }
    ]
}