{
  "version": "1.0",
  "id": "TP5",
  "name": "Toy Problem 5",
  "description": "Pick and place blueprints",
  "tasks": [
    {
      "id": "start",
      "type": "system.start",
      "outputs": [
        {
          "name": "process_start_time",
          "type_hint": "timestamp"
        }
      ]
    },
    {
      "id": "X1",
      "type": "system.composite",
      "description": "Pick and Place",
      "inputs": [
        {
          "name": "something",
          "type_hint": "str"
        }
      ],
      "outputs": [
        {
          "name": "result1",
          "type_hint": "str"
        }
      ],
      "params": [
        {
          "name": "blueprint",
          "value": {
            "static": "toy_problem_5_inner_pnp.json"
          }
        }
      ],
      "depends_on": [
        {
          "id": "start"
        }
      ]
    },
    {
      "id": "end",
      "type": "system.end",
      "outputs": [
        {
          "name": "process_end_time",
          "type_hint": "timestamp"
        }
      ],
      "depends_on": [
        {
          "id": "X1"
        }
      ]
    }
  ]
}